{"bindingSha256":"9e8e886b3036de09dd42d658f38a3fdc1fa5e07b324ea8a6442e6317cd03743f","bundleSha256":"65696007b254503ac5aff162eff4fcf5ac30b095d8da86a267e02794911f1e14","candidateId":"ch17.ru.r5.20261002.r2","coveredSurfaceIds":["doc.contract","doc.lesson","doc.rendered","doc.sheet","unit.001","unit.002","unit.003","unit.004","unit.005","unit.006","unit.007","unit.008","unit.009","unit.010","unit.011","unit.012","unit.013","unit.014","unit.015","unit.016","unit.017","unit.018","unit.019","unit.020","unit.021","unit.022","unit.023","unit.024","unit.025","unit.026","unit.027","unit.028","unit.029","unit.030","unit.031","unit.032","unit.033","unit.034","unit.035","unit.036","unit.037","unit.038","unit.039","unit.040","unit.041","unit.042","unit.043","unit.044","unit.045","unit.046","unit.047","unit.048","unit.049","unit.050","unit.051","unit.052","unit.053","unit.054","unit.055","unit.056","unit.057","unit.058","unit.059","unit.060","unit.061","unit.062","unit.063","unit.064","unit.065","unit.066","unit.067","unit.068","unit.069","unit.070","unit.071","unit.072","unit.073","unit.074","unit.075","unit.076","unit.077","unit.078","unit.079","unit.080","unit.081","unit.082","unit.083","unit.084","unit.085","unit.086","unit.087","unit.088","unit.089","unit.090","unit.091","unit.092","unit.093","unit.094","unit.095","unit.096","unit.097","unit.098","unit.099","unit.100","unit.101","unit.102","unit.103","unit.104","unit.105","unit.106","unit.107","unit.108","unit.109","unit.110","unit.111","unit.112","unit.113","unit.114","unit.115","unit.116","unit.117","unit.118","unit.119","unit.120","unit.121","unit.122","unit.123","unit.124","unit.125","unit.126","unit.127","unit.128","unit.129"],"findings":[],"inventorySha256":"1d3b37c1ae8dc55bfc3e01ded83c386c549ee4aec4c33ed2920021471ad04901","reviewId":"ch17.ru.r5.20261002.r2.bilingual","reviewer":{"completedAt":"2026-10-03T08:17:55Z","contextId":"ch17_v5_ru_r2_bilingual","contextSha256":"c474ee6822527f8cc0624a90d9ebf4f273be00b06fa1fa91869d4f7c305141e7","freshContext":true,"model":"gpt-6.1-sol","promptSha256":"dc30f2241e499b5715b0e0d99cb225145d0966ec51036110db4720775957768d","reasoning":"xhigh","startedAt":"2026-10-03T08:11:39Z"},"role":"bilingual","rubricSha256":"e77c92885b64cf2a4621ddc5d9be1e1380cc5b3c6b2e0f834d9265538d1657dd","schemaVersion":1,"scopeId":"ch17.ru.20261002.r2","sourceSha256":"5ff48e8695dc8c4ed3c9cfe0b0c04c921403d1ebf7edfe1a9fb78f71e8ee91fd","targetLocale":"ru","targetSha256":"9ee75639807f5a0c49f495f68f9c0128af0505aadacf09394ed7846dcdba626d","verdict":"pass"}
