{"schemaVersion":1,"candidateId":"autograd-context-ch33-ch37.ru.r12-r6.20260918.v4","reviewId":"autograd-context-ch33-ch37.ru.target-only-review.v5","role":"target-only","scopeId":"autograd-context-ch33-ch37.ru.20260918.v4","targetLocale":"ru","bindingSha256":"69a7f560a04a47992e5bde9b3f2fdd983b95ef78a89ca2ddf40989a7a0ffcebb","bundleSha256":"844a6c2adff834a1c8af525b5378268f505155f9727346cce89f15d4ed53037b","targetSha256":"3dd404f3a443acc40defdb17a8b1549a21c9a7cf386829d99987898074e37a64","inventorySha256":"e9afa3ba08dfb7572e523d349e857fd212fa47fcf972059aadfad5987f1c992f","rubricSha256":"5c858e4b36c4992b312dd75772fd04d6d045fda76f415add9135cc5dc7047428","reviewer":{"contextId":"collab:root:ru_target_only_review_v5","contextSha256":"6826b0418479258c05d3f16be4f25794896bc41bb2179e18db737bc50fd0cbbf","freshContext":true,"model":"gpt-5.6-sol","reasoning":"ultra","promptSha256":"c1deab1e49ab84b09eff603911a35b4487cb43ba2a851580db7d1b3e3aec143d","startedAt":"2026-09-18T09:30:49Z","completedAt":"2026-09-18T09:34:42Z"},"coveredSurfaceIds":["ch33.autograd-explanation","ch33.complete","ch33.context-card","ch33.policy-card","ch37.cheat-sheet.complete","ch37.cheat-sheet.layer-bound-cache","ch37.complete","ch37.context-explanation"],"verdict":"pass","findings":[]}
