{"schemaVersion":1,"candidateId":"autograd-context-ch33-ch37.ru.r12-r6.20260918.v2","reviewId":"autograd-context-ch33-ch37.ru.r12-r6.20260918.v2-target-only-v3","role":"target-only","scopeId":"autograd-context-ch33-ch37.ru.20260918.v2","targetLocale":"ru","bindingSha256":"f68673fb4e3cfbdf39a7b8462da84e239afc10fb32c60942e1b24bdc9f3be172","bundleSha256":"9a1e10611c2d0f6fee14c8251e3c727c66d26f8e107e17f962adbe86e9240747","targetSha256":"f97e1df2b2d6d729d49383c75d609664bc40eecaabf58b9c86250da2716dc393","inventorySha256":"3a5d7f31d9bb47ce97a8ab3890a99b04a8fd692f112b4c68f52c5ef269ac305c","rubricSha256":"5c858e4b36c4992b312dd75772fd04d6d045fda76f415add9135cc5dc7047428","reviewer":{"contextId":"collab:root:ru_target_only_review_v3","contextSha256":"cf8a98ae1a15f94c26441b4a30f0c7202e5021a4bb60a461defbd5a7b7922447","freshContext":true,"model":"gpt-5.6-sol","reasoning":"ultra","promptSha256":"c1deab1e49ab84b09eff603911a35b4487cb43ba2a851580db7d1b3e3aec143d","startedAt":"2026-09-18T09:14:48Z","completedAt":"2026-09-18T09:18:20Z"},"coveredSurfaceIds":["ch33.autograd-explanation","ch33.complete","ch33.context-card","ch33.policy-card","ch37.cheat-sheet.complete","ch37.cheat-sheet.layer-bound-cache","ch37.complete","ch37.context-explanation"],"verdict":"fail","findings":[{"id":"ch37.context-explanation.unresolved-prior-checks","category":"coherence","severity":"blocking","surfaceIds":["ch37.context-explanation"],"evidence":"Изолированная поверхность начинается словами «После этих проверок», но внутри неё не названы сами проверки или условия, к которым относится указательное слово «эти».","learnerConsequence":"Без соседнего текста читатель не может определить, какие предварительные условия уже подтверждены перед созданием `AutogradContext::no_grad()` и передачей управления общей функции, поэтому последовательность самостоятельного вызова изложена неполно.","correctionCriterion":"Начало изолированной поверхности должно прямо назвать выполненные проверки совместимости входа, слоя и кэша, включая наличие свободного места, либо иначе устранить ссылку на отсутствующий предыдущий текст."}]}
